{"authorization":{"generate_and_freeze_supplemental_set":true,"run_supplemental_experiment":false},"authorization_text":"我确认 EXP-001B 补充集生成预检 checksum：dbb17d975d32956fb92ab39975452f00c6bc1ca8b4114afec84f5a46f8242ae6，以及最终预注册 checksum：976cce8c9e3b53bca2d21ae43f273228c45dfc4607f5b652a3d5b5cdc5d823be；授权生成并冻结 EXP-001B 补充测试集，共 11,008 条记录；不授权运行 EXP-001B 正式补充实验。","authorization_version":"0.1","authorized_at_utc":"2026-08-04T05:32:29.191036+00:00","authorized_by_role":"project_owner","experiment_id":"EXP-001B","final_preregistration_digest_sha256":"976cce8c9e3b53bca2d21ae43f273228c45dfc4607f5b652a3d5b5cdc5d823be","parent_core_set_digest_sha256":"6ea2b6be15a7728c96d84dcc8e48da64e740438980f818e78c8ee8570a47eb9d","set_preflight_digest_sha256":"dbb17d975d32956fb92ab39975452f00c6bc1ca8b4114afec84f5a46f8242ae6","total_record_count":11008}
